{
  "apiVersion": "cubica.game/cards-money-trains-content-intake/v1",
  "gameId": "cards-money-trains",
  "locale": "ru-RU",
  "status": "content-intake",
  "publishable": false,
  "source": {
    "path": "draft/trains/Колоди + Новости.xlsx",
    "sha256": "94dd2da5a5ae6f87a7bc138078abae309183e839714cf75c78a950630a21e9a5",
    "sheets": [
      "Колоды по терминалам",
      "Новости (2 типов)"
    ]
  },
  "summary": {
    "cargoRecordCount": 174,
    "baseCargoRecordCount": 112,
    "newsAddedCargoRecordCount": 62,
    "newsRecordCount": 34,
    "cargoAdditionNewsCount": 10,
    "ruleNewsCount": 24
  },
  "authorConfirmations": {
    "oneSourceRowEqualsOneRuntimeCard": true,
    "runtimeDeckLifecycleApproved": true
  },
  "unresolved": {
    "executableNewsMappingComplete": false
  },
  "cargoRecords": [
    {
      "id": "cargo-source-row-002",
      "sourceRow": 2,
      "originNodeId": "terminal-1",
      "destinationNodeId": "terminal-4",
      "bankPayout": 15,
      "sourceDeckLabel": "1 терминал",
      "deck": {
        "kind": "base-terminal",
        "terminalId": "terminal-1"
      }
    },
    {
      "id": "cargo-source-row-003",
      "sourceRow": 3,
      "originNodeId": "terminal-1",
      "destinationNodeId": "terminal-3",
      "bankPayout": 12,
      "sourceDeckLabel": "1 терминал",
      "deck": {
        "kind": "base-terminal",
        "terminalId": "terminal-1"
      }
    },
    {
      "id": "cargo-source-row-004",
      "sourceRow": 4,
      "originNodeId": "terminal-1",
      "destinationNodeId": "terminal-11",
      "bankPayout": 19,
      "sourceDeckLabel": "1 терминал",
      "deck": {
        "kind": "base-terminal",
        "terminalId": "terminal-1"
      }
    },
    {
      "id": "cargo-source-row-005",
      "sourceRow": 5,
      "originNodeId": "terminal-1",
      "destinationNodeId": "terminal-9",
      "bankPayout": 13,
      "sourceDeckLabel": "1 терминал",
      "deck": {
        "kind": "base-terminal",
        "terminalId": "terminal-1"
      }
    },
    {
      "id": "cargo-source-row-006",
      "sourceRow": 6,
      "originNodeId": "terminal-1",
      "destinationNodeId": "terminal-6",
      "bankPayout": 11,
      "sourceDeckLabel": "1 терминал",
      "deck": {
        "kind": "base-terminal",
        "terminalId": "terminal-1"
      }
    },
    {
      "id": "cargo-source-row-007",
      "sourceRow": 7,
      "originNodeId": "terminal-10",
      "destinationNodeId": "terminal-3",
      "bankPayout": 21,
      "sourceDeckLabel": "10 терминал",
      "deck": {
        "kind": "base-terminal",
        "terminalId": "terminal-10"
      }
    },
    {
      "id": "cargo-source-row-008",
      "sourceRow": 8,
      "originNodeId": "terminal-10",
      "destinationNodeId": "terminal-8",
      "bankPayout": 16,
      "sourceDeckLabel": "10 терминал",
      "deck": {
        "kind": "base-terminal",
        "terminalId": "terminal-10"
      }
    },
    {
      "id": "cargo-source-row-009",
      "sourceRow": 9,
      "originNodeId": "terminal-10",
      "destinationNodeId": "terminal-5",
      "bankPayout": 14,
      "sourceDeckLabel": "10 терминал",
      "deck": {
        "kind": "base-terminal",
        "terminalId": "terminal-10"
      }
    },
    {
      "id": "cargo-source-row-010",
      "sourceRow": 10,
      "originNodeId": "terminal-10",
      "destinationNodeId": "terminal-11",
      "bankPayout": 13,
      "sourceDeckLabel": "10 терминал",
      "deck": {
        "kind": "base-terminal",
        "terminalId": "terminal-10"
      }
    },
    {
      "id": "cargo-source-row-011",
      "sourceRow": 11,
      "originNodeId": "terminal-10",
      "destinationNodeId": "terminal-22",
      "bankPayout": 20,
      "sourceDeckLabel": "10 терминал",
      "deck": {
        "kind": "base-terminal",
        "terminalId": "terminal-10"
      }
    },
    {
      "id": "cargo-source-row-012",
      "sourceRow": 12,
      "originNodeId": "terminal-10",
      "destinationNodeId": "terminal-16",
      "bankPayout": 21,
      "sourceDeckLabel": "10 терминал",
      "deck": {
        "kind": "base-terminal",
        "terminalId": "terminal-10"
      }
    },
    {
      "id": "cargo-source-row-013",
      "sourceRow": 13,
      "originNodeId": "terminal-11",
      "destinationNodeId": "terminal-9",
      "bankPayout": 15,
      "sourceDeckLabel": "11 терминал",
      "deck": {
        "kind": "base-terminal",
        "terminalId": "terminal-11"
      }
    },
    {
      "id": "cargo-source-row-014",
      "sourceRow": 14,
      "originNodeId": "terminal-11",
      "destinationNodeId": "terminal-6",
      "bankPayout": 10,
      "sourceDeckLabel": "11 терминал",
      "deck": {
        "kind": "base-terminal",
        "terminalId": "terminal-11"
      }
    },
    {
      "id": "cargo-source-row-015",
      "sourceRow": 15,
      "originNodeId": "terminal-11",
      "destinationNodeId": "terminal-1",
      "bankPayout": 19,
      "sourceDeckLabel": "11 терминал",
      "deck": {
        "kind": "base-terminal",
        "terminalId": "terminal-11"
      }
    },
    {
      "id": "cargo-source-row-016",
      "sourceRow": 16,
      "originNodeId": "terminal-11",
      "destinationNodeId": "terminal-18",
      "bankPayout": 21,
      "sourceDeckLabel": "11 терминал",
      "deck": {
        "kind": "base-terminal",
        "terminalId": "terminal-11"
      }
    },
    {
      "id": "cargo-source-row-017",
      "sourceRow": 17,
      "originNodeId": "terminal-11",
      "destinationNodeId": "terminal-22",
      "bankPayout": 8,
      "sourceDeckLabel": "11 терминал",
      "deck": {
        "kind": "base-terminal",
        "terminalId": "terminal-11"
      }
    },
    {
      "id": "cargo-source-row-018",
      "sourceRow": 18,
      "originNodeId": "terminal-11",
      "destinationNodeId": "terminal-23",
      "bankPayout": 16,
      "sourceDeckLabel": "11 терминал",
      "deck": {
        "kind": "base-terminal",
        "terminalId": "terminal-11"
      }
    },
    {
      "id": "cargo-source-row-019",
      "sourceRow": 19,
      "originNodeId": "terminal-12",
      "destinationNodeId": "terminal-21",
      "bankPayout": 20,
      "sourceDeckLabel": "12 терминал",
      "deck": {
        "kind": "base-terminal",
        "terminalId": "terminal-12"
      }
    },
    {
      "id": "cargo-source-row-020",
      "sourceRow": 20,
      "originNodeId": "terminal-12",
      "destinationNodeId": "terminal-13",
      "bankPayout": 13,
      "sourceDeckLabel": "12 терминал",
      "deck": {
        "kind": "base-terminal",
        "terminalId": "terminal-12"
      }
    },
    {
      "id": "cargo-source-row-021",
      "sourceRow": 21,
      "originNodeId": "terminal-12",
      "destinationNodeId": "terminal-19",
      "bankPayout": 24,
      "sourceDeckLabel": "12 терминал",
      "deck": {
        "kind": "base-terminal",
        "terminalId": "terminal-12"
      }
    },
    {
      "id": "cargo-source-row-022",
      "sourceRow": 22,
      "originNodeId": "terminal-12",
      "destinationNodeId": "terminal-15",
      "bankPayout": 31,
      "sourceDeckLabel": "12 терминал",
      "deck": {
        "kind": "base-terminal",
        "terminalId": "terminal-12"
      }
    },
    {
      "id": "cargo-source-row-023",
      "sourceRow": 23,
      "originNodeId": "terminal-13",
      "destinationNodeId": "terminal-8",
      "bankPayout": 20,
      "sourceDeckLabel": "13 терминал",
      "deck": {
        "kind": "base-terminal",
        "terminalId": "terminal-13"
      }
    },
    {
      "id": "cargo-source-row-024",
      "sourceRow": 24,
      "originNodeId": "terminal-13",
      "destinationNodeId": "terminal-7",
      "bankPayout": 12,
      "sourceDeckLabel": "13 терминал",
      "deck": {
        "kind": "base-terminal",
        "terminalId": "terminal-13"
      }
    },
    {
      "id": "cargo-source-row-025",
      "sourceRow": 25,
      "originNodeId": "terminal-13",
      "destinationNodeId": "terminal-20",
      "bankPayout": 12,
      "sourceDeckLabel": "13 терминал",
      "deck": {
        "kind": "base-terminal",
        "terminalId": "terminal-13"
      }
    },
    {
      "id": "cargo-source-row-026",
      "sourceRow": 26,
      "originNodeId": "terminal-13",
      "destinationNodeId": "terminal-14",
      "bankPayout": 15,
      "sourceDeckLabel": "13 терминал",
      "deck": {
        "kind": "base-terminal",
        "terminalId": "terminal-13"
      }
    },
    {
      "id": "cargo-source-row-027",
      "sourceRow": 27,
      "originNodeId": "terminal-13",
      "destinationNodeId": "terminal-19",
      "bankPayout": 13,
      "sourceDeckLabel": "13 терминал",
      "deck": {
        "kind": "base-terminal",
        "terminalId": "terminal-13"
      }
    },
    {
      "id": "cargo-source-row-028",
      "sourceRow": 28,
      "originNodeId": "terminal-13",
      "destinationNodeId": "terminal-16",
      "bankPayout": 12,
      "sourceDeckLabel": "13 терминал",
      "deck": {
        "kind": "base-terminal",
        "terminalId": "terminal-13"
      }
    },
    {
      "id": "cargo-source-row-029",
      "sourceRow": 29,
      "originNodeId": "terminal-14",
      "destinationNodeId": "terminal-22",
      "bankPayout": 25,
      "sourceDeckLabel": "14 терминал",
      "deck": {
        "kind": "base-terminal",
        "terminalId": "terminal-14"
      }
    },
    {
      "id": "cargo-source-row-030",
      "sourceRow": 30,
      "originNodeId": "terminal-14",
      "destinationNodeId": "terminal-15",
      "bankPayout": 15,
      "sourceDeckLabel": "14 терминал",
      "deck": {
        "kind": "base-terminal",
        "terminalId": "terminal-14"
      }
    },
    {
      "id": "cargo-source-row-031",
      "sourceRow": 31,
      "originNodeId": "terminal-14",
      "destinationNodeId": "terminal-4",
      "bankPayout": 34,
      "sourceDeckLabel": "14 терминал",
      "deck": {
        "kind": "base-terminal",